{
  "id": "LCLAIM-BOSNIA-SERBIA-COOPERATION-BREACH",
  "case_ref": "LCASE-ICJ-BOSNIA-SERBIA-91",
  "proposition": "Serbia breached obligations connected with failure fully to cooperate with the ICTY.",
  "claim_type": "responsibility",
  "asserted_by_refs": [
    "AUTH-ICJ-91-JUDGMENT-2007-02-26"
  ],
  "basis_refs": [
    "LAW-UN-GENOCIDE-1948",
    "APPL-BOSNIA-SERBIA-GENOCIDE-ICJ",
    "HOLD-ICJ-91-COOPERATION-BREACH"
  ],
  "evidence_refs": [
    "SRC-AWS-ICJ"
  ],
  "contrary_authority_refs": [],
  "counterclaim_refs": [],
  "scope_note": "This claim is distinct from both commission and prevention findings.",
  "status": "SUPPORTED",
  "confidence": 0.99
}
